06/05/2003 20:02:27.152495 128.32.38.103.34949 > 64.174.7.218.80: S 3391091379:3391091379(0) win 5840 <mss 1460,sackOK,timestamp 16305688 0,nop,wscale 0> (DF)
06/05/2003 20:02:27.166985 64.174.7.218.80 > 128.32.38.103.34949: S 691582366:691582366(0) ack 3391091380 win 1380 <mss 1380,nop,nop,timestamp 3684637 16305688,nop,nop,sackOK> (DF)
06/05/2003 20:02:27.167921 128.32.38.103.34949 > 64.174.7.218.80: . ack 1 win 5840 <nop,nop,timestamp 16305689 3684637> (DF)
06/05/2003 20:02:27.169915 128.32.38.103.34949 > 64.174.7.218.80: P 1:123(122) ack 1 win 5840 <nop,nop,timestamp 16305689 3684637> (DF)
06/05/2003 20:02:27.184135 64.174.7.218.80 > 128.32.38.103.34949: . ack 123 win 32767 <nop,nop,timestamp 3684637 16305689> (DF)
06/05/2003 20:02:27.189648 64.174.7.218.80 > 128.32.38.103.34949: . 1:1369(1368) ack 123 win 32767 <nop,nop,timestamp 3684637 16305689> (DF)
06/05/2003 20:02:27.190577 128.32.38.103.34949 > 64.174.7.218.80: . ack 1369 win 8208 <nop,nop,timestamp 16305691 3684637> (DF)
06/05/2003 20:02:27.193040 64.174.7.218.80 > 128.32.38.103.34949: . 1369:2737(1368) ack 123 win 32767 <nop,nop,timestamp 3684637 16305689> (DF)
06/05/2003 20:02:27.194443 128.32.38.103.34949 > 64.174.7.218.80: . ack 2737 win 10944 <nop,nop,timestamp 16305692 3684637> (DF)
06/05/2003 20:02:27.206814 64.174.7.218.80 > 128.32.38.103.34949: . 2737:4105(1368) ack 123 win 32767 <nop,nop,timestamp 3684637 16305689> (DF)
06/05/2003 20:02:27.207784 128.32.38.103.34949 > 64.174.7.218.80: . ack 4105 win 13680 <nop,nop,timestamp 16305693 3684637> (DF)
06/05/2003 20:02:27.210273 64.174.7.218.80 > 128.32.38.103.34949: . 4105:5473(1368) ack 123 win 32767 <nop,nop,timestamp 3684637 16305689> (DF)
06/05/2003 20:02:27.212751 64.174.7.218.80 > 128.32.38.103.34949: . 5473:6841(1368) ack 123 win 32767 <nop,nop,timestamp 3684637 16305689> (DF)
06/05/2003 20:02:27.213521 128.32.38.103.34949 > 64.174.7.218.80: . ack 5473 win 16416 <nop,nop,timestamp 16305693 3684637> (DF)
06/05/2003 20:02:27.215153 64.174.7.218.80 > 128.32.38.103.34949: P 6841:7681(840) ack 123 win 32767 <nop,nop,timestamp 3684637 16305689> (DF)
06/05/2003 20:02:27.216870 128.32.38.103.34949 > 64.174.7.218.80: . ack 6841 win 19152 <nop,nop,timestamp 16305694 3684637> (DF)
06/05/2003 20:02:27.217477 128.32.38.103.34949 > 64.174.7.218.80: . ack 7681 win 21888 <nop,nop,timestamp 16305694 3684637> (DF)
06/05/2003 20:02:27.218370 128.32.38.103.34949 > 64.174.7.218.80: F 123:123(0) ack 7681 win 21888 <nop,nop,timestamp 16305694 3684637> (DF)
06/05/2003 20:02:27.235200 64.174.7.218.80 > 128.32.38.103.34949: . ack 124 win 32767 <nop,nop,timestamp 3684637 16305694> (DF)
06/05/2003 20:02:27.235708 64.174.7.218.80 > 128.32.38.103.34949: F 7681:7681(0) ack 124 win 49152 <nop,nop,timestamp 3684637 16305694> (DF)
06/05/2003 20:02:27.236654 128.32.38.103.34949 > 64.174.7.218.80: . ack 7682 win 21888 <nop,nop,timestamp 16305696 3684637> (DF)
06/05/2003 20:02:33.270189 128.32.39.136.2747 > 128.32.25.39.110: S 2803345997:2803345997(0) win 16384 <mss 1460,nop,wscale 0,nop,nop,timestamp 0 0,nop,nop,sackOK> (DF)
06/05/2003 20:02:33.271443 128.32.25.39.110 > 128.32.39.136.2747: S 3344585456:3344585456(0) ack 2803345998 win 61440 <mss 1460,nop,wscale 0>
06/05/2003 20:02:33.272556 128.32.39.136.2747 > 128.32.25.39.110: . ack 1 win 17520 (DF)
06/05/2003 20:02:33.285408 128.32.25.39.2377 > 128.32.39.136.113: S 1346349056:1346349056(0) win 61440 <mss 1460,nop,wscale 0>
06/05/2003 20:02:33.286527 128.32.39.136.113 > 128.32.25.39.2377: R 0:0(0) ack 1346349057 win 0
06/05/2003 20:02:33.315834 128.32.25.39.110 > 128.32.39.136.2747: P 1:74(73) ack 1 win 61440 (DF)
06/05/2003 20:02:33.317762 128.32.39.136.2747 > 128.32.25.39.110: P 1:16(15) ack 74 win 17447 (DF)
06/05/2003 20:02:33.343752 128.32.39.136.2747 > 128.32.25.39.110: P 16:30(14) ack 104 win 17417 (DF)
06/05/2003 20:02:33.363097 128.32.39.136.2747 > 128.32.25.39.110: P 30:36(6) ack 135 win 17386 (DF)
06/05/2003 20:02:33.371203 128.32.25.39.110 > 128.32.39.136.2747: P 135:150(15) ack 36 win 61440
06/05/2003 20:02:33.372580 128.32.39.136.2747 > 128.32.25.39.110: P 36:42(6) ack 150 win 17371 (DF)
06/05/2003 20:02:33.380388 128.32.39.136.2747 > 128.32.25.39.110: P 42:48(6) ack 985 win 16536 (DF)
06/05/2003 20:02:33.488481 128.32.25.39.110 > 128.32.39.136.2747: P 985:990(5) ack 48 win 61440
06/05/2003 20:02:33.488982 128.32.25.39.110 > 128.32.39.136.2747: F 990:990(0) ack 48 win 61440
06/05/2003 20:02:33.489844 128.32.39.136.2747 > 128.32.25.39.110: F 48:48(0) ack 990 win 16531 (DF)
06/05/2003 20:02:33.490965 128.32.39.136.2747 > 128.32.25.39.110: . ack 991 win 16531 (DF)
06/05/2003 20:02:33.491490 128.32.25.39.110 > 128.32.39.136.2747: F 990:990(0) ack 49 win 61440
06/05/2003 20:02:40.948740 128.32.39.112.3818 > 169.229.60.102.445: P 4071385001:4071385046(45) ack 3247773211 win 17412 (DF)
06/05/2003 20:02:40.950368 169.229.60.102.445 > 128.32.39.112.3818: P 1:40(39) ack 45 win 63927 (DF)
06/05/2003 20:02:40.951745 128.32.39.112.3818 > 169.229.60.102.445: P 45:90(45) ack 40 win 17373 (DF)
06/05/2003 20:02:40.953153 169.229.60.102.445 > 128.32.39.112.3818: P 40:79(39) ack 90 win 63882 (DF)
06/05/2003 20:02:41.103759 128.32.39.112.3818 > 169.229.60.102.445: . ack 79 win 17334 (DF)
06/05/2003 20:02:57.869477 128.32.39.238.32783 > 64.12.25.131.5190: P 818944611:818944617(6) ack 2573386280 win 48960 (DF)
06/05/2003 20:02:58.197732 64.12.25.131.5190 > 128.32.39.238.32783: . ack 6 win 16384 (DF)
06/05/2003 20:03:12.372856 128.32.39.112.3818 > 169.229.60.102.445: P 90:222(132) ack 171 win 17242 (DF)
06/05/2003 20:03:12.503165 128.32.39.112.3818 > 169.229.60.102.445: . ack 279 win 17134 (DF)
06/05/2003 20:03:27.351066 128.32.38.103.34950 > 64.174.7.218.80: S 3461032684:3461032684(0) win 5840 <mss 1460,sackOK,timestamp 16311707 0,nop,wscale 0> (DF)
06/05/2003 20:03:27.363500 64.174.7.218.80 > 128.32.38.103.34950: S 2051187778:2051187778(0) ack 3461032685 win 1380 <mss 1380,nop,nop,timestamp 3684753 16311707,nop,nop,sackOK> (DF)
06/05/2003 20:03:27.364438 128.32.38.103.34950 > 64.174.7.218.80: . ack 1 win 5840 <nop,nop,timestamp 16311709 3684753> (DF)
06/05/2003 20:03:27.365642 128.32.38.103.34950 > 64.174.7.218.80: P 1:123(122) ack 1 win 5840 <nop,nop,timestamp 16311709 3684753> (DF)
06/05/2003 20:03:27.377850 64.174.7.218.80 > 128.32.38.103.34950: . ack 123 win 32767 <nop,nop,timestamp 3684753 16311709> (DF)
06/05/2003 20:03:27.383767 64.174.7.218.80 > 128.32.38.103.34950: . 1:1369(1368) ack 123 win 32767 <nop,nop,timestamp 3684753 16311709> (DF)
06/05/2003 20:03:27.384719 128.32.38.103.34950 > 64.174.7.218.80: . ack 1369 win 8208 <nop,nop,timestamp 16311711 3684753> (DF)
06/05/2003 20:03:27.387176 64.174.7.218.80 > 128.32.38.103.34950: . 1369:2737(1368) ack 123 win 32767 <nop,nop,timestamp 3684753 16311709> (DF)
06/05/2003 20:03:27.389573 128.32.38.103.34950 > 64.174.7.218.80: . ack 2737 win 10944 <nop,nop,timestamp 16311711 3684753> (DF)
06/05/2003 20:03:27.401717 64.174.7.218.80 > 128.32.38.103.34950: . 2737:4105(1368) ack 123 win 32767 <nop,nop,timestamp 3684753 16311709> (DF)
06/05/2003 20:03:27.402717 128.32.38.103.34950 > 64.174.7.218.80: . ack 4105 win 13680 <nop,nop,timestamp 16311713 3684753> (DF)
06/05/2003 20:03:27.405249 64.174.7.218.80 > 128.32.38.103.34950: . 4105:5473(1368) ack 123 win 32767 <nop,nop,timestamp 3684753 16311709> (DF)
06/05/2003 20:03:27.408780 64.174.7.218.80 > 128.32.38.103.34950: . 5473:6841(1368) ack 123 win 32767 <nop,nop,timestamp 3684753 16311709> (DF)
06/05/2003 20:03:27.411082 64.174.7.218.80 > 128.32.38.103.34950: P 6841:7691(850) ack 123 win 32767 <nop,nop,timestamp 3684753 16311709> (DF)
06/05/2003 20:03:27.418689 128.32.38.103.34950 > 64.174.7.218.80: . ack 5473 win 16416 <nop,nop,timestamp 16311713 3684753> (DF)
06/05/2003 20:03:27.419478 128.32.38.103.34950 > 64.174.7.218.80: . ack 6841 win 19152 <nop,nop,timestamp 16311713 3684753> (DF)
06/05/2003 20:03:27.420356 128.32.38.103.34950 > 64.174.7.218.80: . ack 7691 win 21888 <nop,nop,timestamp 16311714 3684753> (DF)
06/05/2003 20:03:27.422301 128.32.38.103.34950 > 64.174.7.218.80: F 123:123(0) ack 7691 win 21888 <nop,nop,timestamp 16311714 3684753> (DF)
06/05/2003 20:03:27.436499 64.174.7.218.80 > 128.32.38.103.34950: . ack 124 win 32767 <nop,nop,timestamp 3684753 16311714> (DF)
06/05/2003 20:03:27.437006 64.174.7.218.80 > 128.32.38.103.34950: F 7691:7691(0) ack 124 win 49152 <nop,nop,timestamp 3684753 16311714> (DF)
06/05/2003 20:03:27.437952 128.32.38.103.34950 > 64.174.7.218.80: . ack 7692 win 21888 <nop,nop,timestamp 16311716 3684753> (DF)
06/05/2003 20:03:34.139978 128.32.39.136.2748 > 128.32.25.39.110: . ack 627941473 win 17520 (DF)
06/05/2003 20:03:34.157401 128.32.25.39.1501 > 128.32.39.136.113: S 1551568896:1551568896(0) win 61440 <mss 1460,nop,wscale 0>
06/05/2003 20:03:34.196101 128.32.25.39.110 > 128.32.39.136.2748: . ack 15 win 61440
06/05/2003 20:03:34.219293 128.32.39.136.2748 > 128.32.25.39.110: P 15:29(14) ack 104 win 17417 (DF)
06/05/2003 20:03:34.232370 128.32.25.39.110 > 128.32.39.136.2748: P 135:150(15) ack 35 win 61440
06/05/2003 20:03:34.270715 128.32.25.39.110 > 128.32.39.136.2748: P 985:990(5) ack 47 win 61440
06/05/2003 20:03:34.271209 128.32.25.39.110 > 128.32.39.136.2748: F 990:990(0) ack 47 win 61440
06/05/2003 20:03:34.272093 128.32.39.136.2748 > 128.32.25.39.110: F 47:47(0) ack 990 win 16531 (DF)
06/05/2003 20:03:34.272770 128.32.39.136.2748 > 128.32.25.39.110: . ack 991 win 16531 (DF)
06/05/2003 20:03:34.274698 128.32.25.39.110 > 128.32.39.136.2748: F 990:990(0) ack 48 win 61440
06/05/2003 20:03:40.954626 128.32.39.112.3818 > 169.229.60.102.445: P 222:267(45) ack 279 win 17134 (DF)
06/05/2003 20:03:41.093752 128.32.39.112.3818 > 169.229.60.102.445: . ack 318 win 17095 (DF)
06/05/2003 20:03:57.878830 128.32.39.238.32783 > 64.12.25.131.5190: P 6:12(6) ack 1 win 48960 (DF)
06/05/2003 20:03:58.162748 64.12.25.131.5190 > 128.32.39.238.32783: . ack 12 win 16384 (DF)
06/05/2003 20:04:02.525066 128.32.38.156.1257 > 169.229.60.100.135: S 571067723:571067723(0) win 16384 <mss 1460,nop,nop,sackOK> (DF)
06/05/2003 20:04:02.527246 169.229.60.100.135 > 128.32.38.156.1257: S 1923143462:1923143462(0) ack 571067724 win 64240 <mss 1460,nop,nop,sackOK> (DF)
06/05/2003 20:04:02.528283 128.32.38.156.1257 > 169.229.60.100.135: . ack 1 win 17520 (DF)
06/05/2003 20:04:02.529227 128.32.38.156.1257 > 169.229.60.100.135: P 1:73(72) ack 1 win 17520 (DF)
06/05/2003 20:04:02.530515 169.229.60.100.135 > 128.32.38.156.1257: P 1:61(60) ack 73 win 64168 (DF)
06/05/2003 20:04:02.531950 128.32.38.156.1257 > 169.229.60.100.135: P 73:229(156) ack 61 win 17460 (DF)
06/05/2003 20:04:02.533856 169.229.60.100.135 > 128.32.38.156.1257: P 61:213(152) ack 229 win 64012 (DF)
06/05/2003 20:04:02.536431 128.32.38.156.1258 > 169.229.60.100.1026: S 571125974:571125974(0) win 16384 <mss 1460,nop,nop,sackOK> (DF)
06/05/2003 20:04:02.538416 169.229.60.100.1026 > 128.32.38.156.1258: S 1923177730:1923177730(0) ack 571125975 win 64240 <mss 1460,nop,nop,sackOK> (DF)
06/05/2003 20:04:02.539434 128.32.38.156.1258 > 169.229.60.100.1026: . ack 1 win 17520 (DF)
06/05/2003 20:04:02.559581 128.32.38.156.1258 > 169.229.60.100.1026: . 1:1461(1460) ack 1 win 17520 (DF)
06/05/2003 20:04:02.562360 169.229.60.100.1026 > 128.32.38.156.1258: . ack 2852 win 64240 (DF)
06/05/2003 20:04:02.564896 169.229.60.100.1026 > 128.32.38.156.1258: P 1:339(338) ack 2852 win 64240 (DF)
06/05/2003 20:04:02.566867 128.32.38.156.1258 > 169.229.60.100.1026: P 2852:3029(177) ack 339 win 17182 (DF)
06/05/2003 20:04:02.569243 169.229.60.100.1026 > 128.32.38.156.1258: P 339:412(73) ack 3029 win 64063 (DF)
06/05/2003 20:04:02.571025 128.32.38.156.1258 > 169.229.60.100.1026: P 3029:3170(141) ack 412 win 17109 (DF)
06/05/2003 20:04:02.572944 169.229.60.100.1026 > 128.32.38.156.1258: P 412:553(141) ack 3170 win 63922 (DF)
06/05/2003 20:04:02.574957 128.32.38.156.1258 > 169.229.60.100.1026: P 3170:3359(189) ack 553 win 16968 (DF)
06/05/2003 20:04:02.578014 169.229.60.100.1026 > 128.32.38.156.1258: P 553:854(301) ack 3359 win 63733 (DF)
06/05/2003 20:04:02.579849 128.32.38.156.1258 > 169.229.60.100.1026: P 3359:3548(189) ack 854 win 16667 (DF)
06/05/2003 20:04:02.583208 169.229.60.100.1026 > 128.32.38.156.1258: P 854:1123(269) ack 3548 win 63544 (DF)
06/05/2003 20:04:02.584740 128.32.38.156.1258 > 169.229.60.100.1026: P 3548:3657(109) ack 1123 win 16398 (DF)
06/05/2003 20:04:02.586452 169.229.60.100.1026 > 128.32.38.156.1258: P 1123:1232(109) ack 3657 win 63435 (DF)
06/05/2003 20:04:02.637990 128.32.38.156.1257 > 169.229.60.100.135: . ack 213 win 17308 (DF)
06/05/2003 20:04:02.730045 128.32.38.156.1261 > 169.229.60.100.389: S 571215357:571215357(0) win 16384 <mss 1460,nop,nop,sackOK> (DF)
06/05/2003 20:04:02.731928 169.229.60.100.389 > 128.32.38.156.1261: S 1923271769:1923271769(0) ack 571215358 win 64240 <mss 1460,nop,nop,sackOK> (DF)
06/05/2003 20:04:02.732979 128.32.38.156.1261 > 169.229.60.100.389: . ack 1 win 17520 (DF)
06/05/2003 20:04:02.738329 128.32.38.156.1261 > 169.229.60.100.389: P 1:351(350) ack 1 win 17520 (DF)
06/05/2003 20:04:02.738836 128.32.38.156.1258 > 169.229.60.100.1026: . ack 1232 win 16289 (DF)
06/05/2003 20:04:02.743242 169.229.60.100.389 > 128.32.38.156.1261: . 1:1461(1460) ack 351 win 63890 (DF)
06/05/2003 20:04:02.743531 169.229.60.100.389 > 128.32.38.156.1261: P 1461:1792(331) ack 351 win 63890 (DF)
06/05/2003 20:04:02.745091 128.32.38.156.1261 > 169.229.60.100.389: . ack 1792 win 17520 (DF)
06/05/2003 20:04:02.766427 128.32.38.156.1261 > 169.229.60.100.389: . 351:1811(1460) ack 1792 win 17520 (DF)
06/05/2003 20:04:02.766549 128.32.38.156.1261 > 169.229.60.100.389: P 1811:1833(22) ack 1792 win 17520 (DF)
06/05/2003 20:04:02.767840 169.229.60.100.389 > 128.32.38.156.1261: . ack 1833 win 64240 (DF)
06/05/2003 20:04:02.771159 169.229.60.100.389 > 128.32.38.156.1261: P 1792:2124(332) ack 1833 win 64240 (DF)
06/05/2003 20:04:02.774149 128.32.38.156.1261 > 169.229.60.100.389: P 1833:2093(260) ack 2124 win 17188 (DF)
06/05/2003 20:04:02.779328 169.229.60.100.389 > 128.32.38.156.1261: P 2124:3053(929) ack 2093 win 63980 (DF)
06/05/2003 20:04:02.785872 128.32.38.156.1263 > 169.229.60.100.389: S 571299165:571299165(0) win 16384 <mss 1460,nop,nop,sackOK> (DF)
06/05/2003 20:04:02.788185 169.229.60.100.389 > 128.32.38.156.1263: S 1923335511:1923335511(0) ack 571299166 win 64240 <mss 1460,nop,nop,sackOK> (DF)
06/05/2003 20:04:02.789201 128.32.38.156.1263 > 169.229.60.100.389: . ack 1 win 17520 (DF)
06/05/2003 20:04:02.795796 128.32.38.156.1263 > 169.229.60.100.389: . 1:1461(1460) ack 1 win 17520 (DF)
06/05/2003 20:04:02.795919 128.32.38.156.1263 > 169.229.60.100.389: P 1461:1483(22) ack 1 win 17520 (DF)
06/05/2003 20:04:02.796563 169.229.60.100.389 > 128.32.38.156.1263: . ack 1483 win 64240 (DF)
06/05/2003 20:04:02.799910 169.229.60.100.389 > 128.32.38.156.1263: P 1:333(332) ack 1483 win 64240 (DF)
06/05/2003 20:04:02.805617 128.32.38.156.1263 > 169.229.60.100.389: P 1483:1635(152) ack 333 win 17188 (DF)
06/05/2003 20:04:02.810148 169.229.60.100.389 > 128.32.38.156.1263: P 333:514(181) ack 1635 win 64088 (DF)
06/05/2003 20:04:02.812144 128.32.38.156.1263 > 169.229.60.100.389: P 1635:1816(181) ack 514 win 17007 (DF)
06/05/2003 20:04:02.814349 169.229.60.100.389 > 128.32.38.156.1263: P 514:670(156) ack 1816 win 63907 (DF)
06/05/2003 20:04:02.819054 128.32.38.156.1261 > 169.229.60.100.389: P 2093:3179(1086) ack 3053 win 16259 (DF)
06/05/2003 20:04:02.827814 169.229.60.100.389 > 128.32.38.156.1261: . 3053:4513(1460) ack 3179 win 62894 (DF)
06/05/2003 20:04:02.830746 169.229.60.100.389 > 128.32.38.156.1261: . 4513:5973(1460) ack 3179 win 62894 (DF)
06/05/2003 20:04:02.833678 169.229.60.100.389 > 128.32.38.156.1261: . 5973:7433(1460) ack 3179 win 62894 (DF)
06/05/2003 20:04:02.836623 169.229.60.100.389 > 128.32.38.156.1261: . 7433:8893(1460) ack 3179 win 62894 (DF)
06/05/2003 20:04:02.837286 169.229.60.100.389 > 128.32.38.156.1261: P 8893:9383(490) ack 3179 win 62894 (DF)
06/05/2003 20:04:02.837623 128.32.38.156.1261 > 169.229.60.100.389: . ack 5973 win 17520 (DF)
06/05/2003 20:04:02.838405 128.32.38.156.1261 > 169.229.60.100.389: . ack 7433 win 17520 (DF)
06/05/2003 20:04:02.839384 128.32.38.156.1261 > 169.229.60.100.389: . ack 9383 win 17520 (DF)
06/05/2003 20:04:02.849759 128.32.38.156.1264 > 169.229.60.100.445: S 571388609:571388609(0) win 16384 <mss 1460,nop,nop,sackOK> (DF)
06/05/2003 20:04:02.852020 169.229.60.100.445 > 128.32.38.156.1264: S 1923398247:1923398247(0) ack 571388610 win 64240 <mss 1460,nop,nop,sackOK> (DF)
06/05/2003 20:04:02.853080 128.32.38.156.1264 > 169.229.60.100.445: . ack 1 win 17520 (DF)
06/05/2003 20:04:02.854345 128.32.38.156.1264 > 169.229.60.100.445: P 1:138(137) ack 1 win 17520 (DF)
06/05/2003 20:04:02.856305 169.229.60.100.445 > 128.32.38.156.1264: P 1:184(183) ack 138 win 64103 (DF)
06/05/2003 20:04:02.938931 128.32.38.156.1263 > 169.229.60.100.389: . ack 670 win 16851 (DF)
06/05/2003 20:04:02.939896 128.32.38.156.1264 > 169.229.60.100.445: . ack 184 win 17337 (DF)
06/05/2003 20:04:02.946553 128.32.38.156.1264 > 169.229.60.100.445: . 138:1598(1460) ack 184 win 17337 (DF)
06/05/2003 20:04:02.948843 128.32.38.156.1264 > 169.229.60.100.445: . 1598:3058(1460) ack 184 win 17337 (DF)
06/05/2003 20:04:02.948962 128.32.38.156.1264 > 169.229.60.100.445: P 3058:3072(14) ack 184 win 17337 (DF)
06/05/2003 20:04:02.949775 169.229.60.100.445 > 128.32.38.156.1264: . ack 3058 win 64240 (DF)
06/05/2003 20:04:02.953253 169.229.60.100.445 > 128.32.38.156.1264: P 184:611(427) ack 3072 win 64226 (DF)
06/05/2003 20:04:02.955380 128.32.38.156.1264 > 169.229.60.100.445: P 3072:3184(112) ack 611 win 16910 (DF)
06/05/2003 20:04:02.957036 169.229.60.100.445 > 128.32.38.156.1264: P 611:671(60) ack 3184 win 64114 (DF)
06/05/2003 20:04:02.959013 128.32.38.156.1264 > 169.229.60.100.445: P 3184:3310(126) ack 671 win 16850 (DF)
06/05/2003 20:04:02.962729 169.229.60.100.445 > 128.32.38.156.1264: P 671:1033(362) ack 3310 win 63988 (DF)
06/05/2003 20:04:03.023339 128.32.38.156.1264 > 169.229.60.100.445: . 3310:4770(1460) ack 1033 win 16488 (DF)
06/05/2003 20:04:03.025965 128.32.38.156.1264 > 169.229.60.100.445: . 4770:6230(1460) ack 1033 win 16488 (DF)
06/05/2003 20:04:03.026095 128.32.38.156.1264 > 169.229.60.100.445: P 6230:6264(34) ack 1033 win 16488 (DF)
06/05/2003 20:04:03.026787 169.229.60.100.445 > 128.32.38.156.1264: . ack 6264 win 64240 (DF)
06/05/2003 20:04:03.030254 169.229.60.100.445 > 128.32.38.156.1264: P 1033:1460(427) ack 6264 win 64240 (DF)
06/05/2003 20:04:03.032427 128.32.38.156.1264 > 169.229.60.100.445: P 6264:6380(116) ack 1460 win 16061 (DF)
06/05/2003 20:04:03.034051 169.229.60.100.445 > 128.32.38.156.1264: P 1460:1526(66) ack 6380 win 64124 (DF)
06/05/2003 20:04:03.035807 128.32.38.156.1264 > 169.229.60.100.445: P 6380:6608(228) ack 1526 win 17520 (DF)
06/05/2003 20:04:03.037698 169.229.60.100.445 > 128.32.38.156.1264: P 1526:1630(104) ack 6608 win 63896 (DF)
06/05/2003 20:04:03.039743 128.32.38.156.1264 > 169.229.60.100.445: P 6608:6836(228) ack 1630 win 17416 (DF)
06/05/2003 20:04:03.041316 169.229.60.100.445 > 128.32.38.156.1264: P 1630:1750(120) ack 6836 win 63668 (DF)
06/05/2003 20:04:03.043483 128.32.38.156.1264 > 169.229.60.100.445: P 6836:7074(238) ack 1750 win 17296 (DF)
06/05/2003 20:04:03.045735 169.229.60.100.445 > 128.32.38.156.1264: P 1750:1889(139) ack 7074 win 63430 (DF)
06/05/2003 20:04:03.047110 128.32.38.156.1264 > 169.229.60.100.445: P 7074:7150(76) ack 1889 win 17157 (DF)
06/05/2003 20:04:03.048425 169.229.60.100.445 > 128.32.38.156.1264: P 1889:1961(72) ack 7150 win 63354 (DF)
06/05/2003 20:04:03.050041 128.32.38.156.1264 > 169.229.60.100.445: P 7150:7213(63) ack 1961 win 17085 (DF)
06/05/2003 20:04:03.051636 169.229.60.100.445 > 128.32.38.156.1264: P 1961:2047(86) ack 7213 win 63291 (DF)
06/05/2003 20:04:03.054113 128.32.38.156.1264 > 169.229.60.100.445: P 7213:7441(228) ack 2047 win 16999 (DF)
06/05/2003 20:04:03.055659 169.229.60.100.445 > 128.32.38.156.1264: P 2047:2151(104) ack 7441 win 63063 (DF)
06/05/2003 20:04:03.057500 128.32.38.156.1264 > 169.229.60.100.445: P 7441:7669(228) ack 2151 win 16895 (DF)
06/05/2003 20:04:03.059273 169.229.60.100.445 > 128.32.38.156.1264: P 2151:2271(120) ack 7669 win 62835 (DF)
06/05/2003 20:04:03.062911 128.32.38.156.1264 > 169.229.60.100.445: P 7669:7907(238) ack 2271 win 16775 (DF)
06/05/2003 20:04:03.065286 169.229.60.100.445 > 128.32.38.156.1264: P 2271:2410(139) ack 7907 win 64240 (DF)
06/05/2003 20:04:03.066667 128.32.38.156.1264 > 169.229.60.100.445: P 7907:7983(76) ack 2410 win 16636 (DF)
06/05/2003 20:04:03.068370 169.229.60.100.445 > 128.32.38.156.1264: P 2410:2482(72) ack 7983 win 64164 (DF)
06/05/2003 20:04:03.070015 128.32.38.156.1264 > 169.229.60.100.445: P 7983:8046(63) ack 2482 win 16564 (DF)
06/05/2003 20:04:03.071593 169.229.60.100.445 > 128.32.38.156.1264: P 2482:2573(91) ack 8046 win 64101 (DF)
06/05/2003 20:04:03.074191 128.32.38.156.1264 > 169.229.60.100.445: P 8046:8274(228) ack 2573 win 16473 (DF)
06/05/2003 20:04:03.076400 169.229.60.100.445 > 128.32.38.156.1264: P 2573:2677(104) ack 8274 win 63873 (DF)
06/05/2003 20:04:03.078228 128.32.38.156.1264 > 169.229.60.100.445: P 8274:8502(228) ack 2677 win 16369 (DF)
06/05/2003 20:04:03.080027 169.229.60.100.445 > 128.32.38.156.1264: P 2677:2797(120) ack 8502 win 63645 (DF)
06/05/2003 20:04:03.082203 128.32.38.156.1264 > 169.229.60.100.445: P 8502:8740(238) ack 2797 win 16249 (DF)
06/05/2003 20:04:03.084038 169.229.60.100.445 > 128.32.38.156.1264: P 2797:2936(139) ack 8740 win 63407 (DF)
06/05/2003 20:04:03.085410 128.32.38.156.1264 > 169.229.60.100.445: P 8740:8816(76) ack 2936 win 16110 (DF)
06/05/2003 20:04:03.087123 169.229.60.100.445 > 128.32.38.156.1264: P 2936:3008(72) ack 8816 win 63331 (DF)
06/05/2003 20:04:03.088882 128.32.38.156.1264 > 169.229.60.100.445: P 8816:8891(75) ack 3008 win 17520 (DF)
06/05/2003 20:04:03.090268 169.229.60.100.445 > 128.32.38.156.1264: P 3008:3051(43) ack 8891 win 63256 (DF)
06/05/2003 20:04:03.091575 128.32.38.156.1264 > 169.229.60.100.445: P 8891:8967(76) ack 3051 win 17477 (DF)
06/05/2003 20:04:03.094465 128.32.38.156.1264 > 169.229.60.100.445: P 8967:9030(63) ack 3139 win 17389 (DF)
06/05/2003 20:04:03.096325 169.229.60.100.445 > 128.32.38.156.1264: P 3139:3229(90) ack 9030 win 63117 (DF)
06/05/2003 20:04:03.097778 128.32.38.156.1264 > 169.229.60.100.445: P 9030:9105(75) ack 3229 win 17299 (DF)
06/05/2003 20:04:03.099051 169.229.60.100.445 > 128.32.38.156.1264: P 3229:3272(43) ack 9105 win 63042 (DF)
06/05/2003 20:04:03.100328 128.32.38.156.1264 > 169.229.60.100.445: P 9105:9150(45) ack 3272 win 17256 (DF)
06/05/2003 20:04:03.104190 128.32.38.156.1264 > 169.229.60.100.445: P 9150:9378(228) ack 3311 win 17217 (DF)
06/05/2003 20:04:03.107748 128.32.38.156.1264 > 169.229.60.100.445: P 9378:9606(228) ack 3415 win 17113 (DF)
06/05/2003 20:04:03.111874 128.32.38.156.1264 > 169.229.60.100.445: P 9606:9844(238) ack 3535 win 16993 (DF)
06/05/2003 20:04:03.115782 128.32.38.156.1264 > 169.229.60.100.445: P 9844:9920(76) ack 3674 win 16854 (DF)
06/05/2003 20:04:03.119449 128.32.38.156.1264 > 169.229.60.100.445: P 9920:9983(63) ack 3746 win 16782 (DF)
06/05/2003 20:04:03.123559 128.32.38.156.1264 > 169.229.60.100.445: P 9983:10211(228) ack 3832 win 16696 (DF)
06/05/2003 20:04:03.125474 169.229.60.100.445 > 128.32.38.156.1264: P 3832:3936(104) ack 10211 win 63407 (DF)
06/05/2003 20:04:03.127319 128.32.38.156.1264 > 169.229.60.100.445: P 10211:10439(228) ack 3936 win 16592 (DF)
06/05/2003 20:04:03.131700 128.32.38.156.1264 > 169.229.60.100.445: P 10439:10677(238) ack 4056 win 16472 (DF)
06/05/2003 20:04:03.135281 128.32.38.156.1264 > 169.229.60.100.445: P 10677:10753(76) ack 4195 win 16333 (DF)
06/05/2003 20:04:03.136597 169.229.60.100.445 > 128.32.38.156.1264: P 4195:4267(72) ack 10753 win 62865 (DF)
06/05/2003 20:04:03.138128 128.32.38.156.1264 > 169.229.60.100.445: P 10753:10816(63) ack 4267 win 16261 (DF)
06/05/2003 20:04:03.139423 169.229.60.100.445 > 128.32.38.156.1264: P 4267:4360(93) ack 10816 win 62802 (DF)
06/05/2003 20:04:03.142079 128.32.38.156.1264 > 169.229.60.100.445: P 10816:11044(228) ack 4360 win 16168 (DF)
06/05/2003 20:04:03.143833 169.229.60.100.445 > 128.32.38.156.1264: P 4360:4464(104) ack 11044 win 64240 (DF)
06/05/2003 20:04:03.145653 128.32.38.156.1264 > 169.229.60.100.445: P 11044:11272(228) ack 4464 win 16064 (DF)
06/05/2003 20:04:03.147443 169.229.60.100.445 > 128.32.38.156.1264: P 4464:4584(120) ack 11272 win 64012 (DF)
06/05/2003 20:04:03.149968 128.32.38.156.1264 > 169.229.60.100.445: P 11272:11510(238) ack 4584 win 17520 (DF)
06/05/2003 20:04:03.152268 169.229.60.100.445 > 128.32.38.156.1264: P 4584:4723(139) ack 11510 win 63774 (DF)
06/05/2003 20:04:03.153635 128.32.38.156.1264 > 169.229.60.100.445: P 11510:11586(76) ack 4723 win 17381 (DF)
06/05/2003 20:04:03.154952 169.229.60.100.445 > 128.32.38.156.1264: P 4723:4795(72) ack 11586 win 63698 (DF)
06/05/2003 20:04:03.156490 128.32.38.156.1264 > 169.229.60.100.445: P 11586:11649(63) ack 4795 win 17309 (DF)
06/05/2003 20:04:03.158166 169.229.60.100.445 > 128.32.38.156.1264: P 4795:4881(86) ack 11649 win 63635 (DF)
06/05/2003 20:04:03.161157 128.32.38.156.1261 > 169.229.60.100.389: P 3179:3240(61) ack 9383 win 17520 (DF)
06/05/2003 20:04:03.162227 128.32.38.156.1261 > 169.229.60.100.389: F 3240:3240(0) ack 9383 win 17520 (DF)
06/05/2003 20:04:03.162896 169.229.60.100.389 > 128.32.38.156.1261: F 9383:9383(0) ack 3240 win 62833 (DF)
06/05/2003 20:04:03.163590 128.32.38.156.1263 > 169.229.60.100.389: P 1816:1877(61) ack 670 win 16851 (DF)
06/05/2003 20:04:03.164056 169.229.60.100.389 > 128.32.38.156.1261: . ack 3241 win 62833 (DF)
06/05/2003 20:04:03.164827 128.32.38.156.1261 > 169.229.60.100.389: . ack 9384 win 17520 (DF)
06/05/2003 20:04:03.165356 169.229.60.100.389 > 128.32.38.156.1263: F 670:670(0) ack 1877 win 63846 (DF)
06/05/2003 20:04:03.166354 128.32.38.156.1263 > 169.229.60.100.389: . ack 671 win 16851 (DF)
06/05/2003 20:04:03.167133 128.32.38.156.1263 > 169.229.60.100.389: F 1877:1877(0) ack 671 win 16851 (DF)
06/05/2003 20:04:03.168415 169.229.60.100.389 > 128.32.38.156.1263: . ack 1878 win 63846 (DF)
06/05/2003 20:04:03.279005 169.229.60.100.445 > 128.32.38.156.1264: P 4881:4936(55) ack 11649 win 63635 (DF)
06/05/2003 20:04:03.280084 128.32.38.156.1264 > 169.229.60.100.445: . ack 4936 win 17168 (DF)
06/05/2003 20:04:03.281110 128.32.38.156.1264 > 169.229.60.100.445: P 11649:11694(45) ack 4936 win 17168 (DF)
06/05/2003 20:04:03.282579 169.229.60.100.445 > 128.32.38.156.1264: P 4936:4975(39) ack 11694 win 63590 (DF)
06/05/2003 20:04:03.315725 169.229.60.100.445 > 128.32.38.156.1264: P 4975:5030(55) ack 11694 win 63590 (DF)
06/05/2003 20:04:03.316798 128.32.38.156.1264 > 169.229.60.100.445: . ack 5030 win 17074 (DF)
06/05/2003 20:04:03.317662 128.32.38.156.1264 > 169.229.60.100.445: P 11694:11739(45) ack 5030 win 17074 (DF)
06/05/2003 20:04:03.321901 169.229.60.100.445 > 128.32.38.156.1264: P 5030:5069(39) ack 11739 win 63545 (DF)
06/05/2003 20:04:03.364790 169.229.60.100.445 > 128.32.38.156.1264: P 5069:5124(55) ack 11739 win 63545 (DF)
06/05/2003 20:04:03.365866 128.32.38.156.1264 > 169.229.60.100.445: . ack 5124 win 16980 (DF)
06/05/2003 20:04:03.366889 128.32.38.156.1264 > 169.229.60.100.445: P 11739:11784(45) ack 5124 win 16980 (DF)
06/05/2003 20:04:03.368355 169.229.60.100.445 > 128.32.38.156.1264: P 5124:5163(39) ack 11784 win 63500 (DF)
06/05/2003 20:04:03.392321 169.229.60.100.445 > 128.32.38.156.1264: P 5163:5218(55) ack 11784 win 63500 (DF)
06/05/2003 20:04:03.393397 128.32.38.156.1264 > 169.229.60.100.445: . ack 5218 win 16886 (DF)
06/05/2003 20:04:03.394262 128.32.38.156.1264 > 169.229.60.100.445: P 11784:11829(45) ack 5218 win 16886 (DF)
06/05/2003 20:04:03.395887 169.229.60.100.445 > 128.32.38.156.1264: P 5218:5257(39) ack 11829 win 63455 (DF)
06/05/2003 20:04:03.420108 128.32.38.156.1264 > 169.229.60.100.445: . ack 5312 win 16792 (DF)
06/05/2003 20:04:03.421233 128.32.38.156.1264 > 169.229.60.100.445: P 11829:11874(45) ack 5312 win 16792 (DF)
06/05/2003 20:04:03.424291 169.229.60.100.445 > 128.32.38.156.1264: P 5312:5351(39) ack 11874 win 63410 (DF)
06/05/2003 20:04:03.540829 128.32.38.156.1264 > 169.229.60.100.445: . ack 5351 win 16753 (DF)
06/05/2003 20:04:05.065455 128.32.38.156.1257 > 169.229.60.100.135: P 229:385(156) ack 213 win 17308 (DF)
06/05/2003 20:04:05.067015 169.229.60.100.135 > 128.32.38.156.1257: P 213:365(152) ack 385 win 63856 (DF)
06/05/2003 20:04:05.069190 128.32.38.156.1258 > 169.229.60.100.1026: P 3657:3798(141) ack 1232 win 16289 (DF)
06/05/2003 20:04:05.070984 169.229.60.100.1026 > 128.32.38.156.1258: P 1232:1373(141) ack 3798 win 63294 (DF)
06/05/2003 20:04:05.072921 128.32.38.156.1258 > 169.229.60.100.1026: P 3798:3987(189) ack 1373 win 16148 (DF)
06/05/2003 20:04:05.076295 169.229.60.100.1026 > 128.32.38.156.1258: P 1373:1578(205) ack 3987 win 63105 (DF)
06/05/2003 20:04:05.077822 128.32.38.156.1258 > 169.229.60.100.1026: P 3987:4096(109) ack 1578 win 17520 (DF)
06/05/2003 20:04:05.079715 169.229.60.100.1026 > 128.32.38.156.1258: P 1578:1687(109) ack 4096 win 62996 (DF)
06/05/2003 20:04:05.248250 128.32.38.156.1258 > 169.229.60.100.1026: . ack 1687 win 17411 (DF)
06/05/2003 20:04:05.249207 128.32.38.156.1257 > 169.229.60.100.135: . ack 365 win 17156 (DF)
06/05/2003 20:04:13.006001 128.32.38.156.1264 > 169.229.60.100.445: P 11874:11917(43) ack 5351 win 16753 (DF)
06/05/2003 20:04:13.007849 169.229.60.100.445 > 128.32.38.156.1264: P 5351:5394(43) ack 11917 win 63367 (DF)
06/05/2003 20:04:13.009042 128.32.38.156.1264 > 169.229.60.100.445: P 11917:11956(39) ack 5394 win 16710 (DF)
06/05/2003 20:04:13.012151 128.32.38.156.1264 > 169.229.60.100.445: P 11956:11999(43) ack 5433 win 16671 (DF)
06/05/2003 20:04:13.015428 169.229.60.100.445 > 128.32.38.156.1264: P 5433:5476(43) ack 11999 win 63285 (DF)
06/05/2003 20:04:13.016615 128.32.38.156.1264 > 169.229.60.100.445: P 11999:12038(39) ack 5476 win 16628 (DF)
06/05/2003 20:04:13.019549 128.32.38.156.1264 > 169.229.60.100.445: F 12038:12038(0) ack 5515 win 16589 (DF)
06/05/2003 20:04:13.020960 169.229.60.100.445 > 128.32.38.156.1264: F 5515:5515(0) ack 12039 win 63246 (DF)
06/05/2003 20:04:13.022039 128.32.38.156.1264 > 169.229.60.100.445: . ack 5516 win 16589 (DF)
06/05/2003 20:04:14.963995 128.32.39.112.3818 > 169.229.60.102.445: P 267:320(53) ack 318 win 17095 (DF)
06/05/2003 20:04:14.965288 169.229.60.102.445 > 128.32.39.112.3818: P 318:371(53) ack 320 win 63652 (DF)
06/05/2003 20:04:15.101290 128.32.39.112.3818 > 169.229.60.102.445: . ack 371 win 17042 (DF)
06/05/2003 20:04:27.820804 128.32.38.103.34951 > 64.174.7.218.80: S 3522580648:3522580648(0) win 5840 <mss 1460,sackOK,timestamp 16317754 0,nop,wscale 0> (DF)
06/05/2003 20:04:27.834105 64.174.7.218.80 > 128.32.38.103.34951: S 557857411:557857411(0) ack 3522580649 win 1380 <mss 1380,nop,nop,timestamp 3684869 16317754,nop,nop,sackOK> (DF)
06/05/2003 20:04:27.835044 128.32.38.103.34951 > 64.174.7.218.80: . ack 1 win 5840 <nop,nop,timestamp 16317756 3684869> (DF)
06/05/2003 20:04:27.835951 128.32.38.103.34951 > 64.174.7.218.80: P 1:123(122) ack 1 win 5840 <nop,nop,timestamp 16317756 3684869> (DF)
06/05/2003 20:04:27.849265 64.174.7.218.80 > 128.32.38.103.34951: . ack 123 win 32767 <nop,nop,timestamp 3684869 16317756> (DF)
06/05/2003 20:04:27.853983 64.174.7.218.80 > 128.32.38.103.34951: . 1:1369(1368) ack 123 win 32767 <nop,nop,timestamp 3684869 16317756> (DF)
06/05/2003 20:04:27.854928 128.32.38.103.34951 > 64.174.7.218.80: . ack 1369 win 8208 <nop,nop,timestamp 16317758 3684869> (DF)
06/05/2003 20:04:27.857422 64.174.7.218.80 > 128.32.38.103.34951: . 1369:2737(1368) ack 123 win 32767 <nop,nop,timestamp 3684869 16317756> (DF)
06/05/2003 20:04:27.858418 128.32.38.103.34951 > 64.174.7.218.80: . ack 2737 win 10944 <nop,nop,timestamp 16317758 3684869> (DF)
06/05/2003 20:04:27.871933 64.174.7.218.80 > 128.32.38.103.34951: . 2737:4105(1368) ack 123 win 32767 <nop,nop,timestamp 3684869 16317756> (DF)
06/05/2003 20:04:27.872911 128.32.38.103.34951 > 64.174.7.218.80: . ack 4105 win 13680 <nop,nop,timestamp 16317760 3684869> (DF)
06/05/2003 20:04:27.875443 64.174.7.218.80 > 128.32.38.103.34951: . 4105:5473(1368) ack 123 win 32767 <nop,nop,timestamp 3684869 16317756> (DF)
06/05/2003 20:04:27.878970 64.174.7.218.80 > 128.32.38.103.34951: . 5473:6841(1368) ack 123 win 32767 <nop,nop,timestamp 3684869 16317756> (DF)
06/05/2003 20:04:27.881198 64.174.7.218.80 > 128.32.38.103.34951: P 6841:7661(820) ack 123 win 32767 <nop,nop,timestamp 3684869 16317756> (DF)
06/05/2003 20:04:27.887777 128.32.38.103.34951 > 64.174.7.218.80: . ack 5473 win 16416 <nop,nop,timestamp 16317760 3684869> (DF)
06/05/2003 20:04:27.890227 128.32.38.103.34951 > 64.174.7.218.80: . ack 6841 win 19152 <nop,nop,timestamp 16317760 3684869> (DF)
06/05/2003 20:04:27.891106 128.32.38.103.34951 > 64.174.7.218.80: . ack 7661 win 21888 <nop,nop,timestamp 16317761 3684869> (DF)
06/05/2003 20:04:27.891712 128.32.38.103.34951 > 64.174.7.218.80: F 123:123(0) ack 7661 win 21888 <nop,nop,timestamp 16317761 3684869> (DF)
06/05/2003 20:04:27.906311 64.174.7.218.80 > 128.32.38.103.34951: . ack 124 win 32767 <nop,nop,timestamp 3684869 16317761> (DF)
06/05/2003 20:04:27.907893 64.174.7.218.80 > 128.32.38.103.34951: F 7661:7661(0) ack 124 win 49152 <nop,nop,timestamp 3684869 16317761> (DF)
06/05/2003 20:04:27.908855 128.32.38.103.34951 > 64.174.7.218.80: . ack 7662 win 21888 <nop,nop,timestamp 16317763 3684869> (DF)
06/05/2003 20:04:29.207865 64.12.25.131.5190 > 128.32.39.238.32783: P 1:53(52) ack 12 win 16384 (DF)
06/05/2003 20:04:29.208872 128.32.39.238.32783 > 64.12.25.131.5190: . ack 53 win 48960 (DF)
06/05/2003 20:04:32.518463 128.32.38.156.1257 > 169.229.60.100.135: F 385:385(0) ack 365 win 17156 (DF)
06/05/2003 20:04:32.519771 169.229.60.100.135 > 128.32.38.156.1257: . ack 386 win 63856 (DF)
06/05/2003 20:04:32.520272 169.229.60.100.135 > 128.32.38.156.1257: F 365:365(0) ack 386 win 63856 (DF)
06/05/2003 20:04:32.521283 128.32.38.156.1257 > 169.229.60.100.135: . ack 366 win 17156 (DF)
06/05/2003 20:04:33.590127 128.32.38.139.32791 > 216.254.0.38.21: R 3218922851:3218922851(0) ack 3275346006 win 5840 <nop,nop,timestamp 134265 2457816897> (DF)
06/05/2003 20:04:34.285985 128.32.38.156.1227 > 169.229.60.38.139: P 200705450:200705454(4) ack 1354520128 win 16382NBT Packet (DF)
06/05/2003 20:04:34.395405 169.229.60.38.139 > 128.32.38.156.1227: . ack 4 win 17520 (DF)
06/05/2003 20:04:34.572459 128.32.39.136.2749 > 128.32.25.39.110: S 2833716237:2833716237(0) win 16384 <mss 1460,nop,wscale 0,nop,nop,timestamp 0 0,nop,nop,sackOK> (DF)
06/05/2003 20:04:34.573749 128.32.25.39.110 > 128.32.39.136.2749: S 3949887936:3949887936(0) ack 2833716238 win 61440 <mss 1460,nop,wscale 0>
06/05/2003 20:04:34.574860 128.32.39.136.2749 > 128.32.25.39.110: . ack 1 win 17520 (DF)
06/05/2003 20:04:34.665518 128.32.25.39.4034 > 128.32.39.136.113: S 1720459264:1720459264(0) win 61440 <mss 1460,nop,wscale 0>
06/05/2003 20:04:34.666631 128.32.39.136.113 > 128.32.25.39.4034: R 0:0(0) ack 1720459265 win 0
06/05/2003 20:04:34.702722 128.32.25.39.110 > 128.32.39.136.2749: P 1:74(73) ack 1 win 61440 (DF)
06/05/2003 20:04:34.704155 128.32.39.136.2749 > 128.32.25.39.110: P 1:16(15) ack 74 win 17447 (DF)
06/05/2003 20:04:34.757577 128.32.25.39.110 > 128.32.39.136.2749: . ack 16 win 61440
06/05/2003 20:04:34.899750 128.32.25.39.110 > 128.32.39.136.2749: P 74:104(30) ack 16 win 61440 (DF)
06/05/2003 20:04:34.901246 128.32.39.136.2749 > 128.32.25.39.110: P 16:30(14) ack 104 win 17417 (DF)
06/05/2003 20:04:34.962348 128.32.25.39.110 > 128.32.39.136.2749: . ack 30 win 61426
06/05/2003 20:04:35.249680 128.32.25.39.110 > 128.32.39.136.2749: P 104:135(31) ack 30 win 61440 (DF)
06/05/2003 20:04:35.271182 128.32.25.39.110 > 128.32.39.136.2749: P 135:150(15) ack 36 win 61440
06/05/2003 20:04:35.272561 128.32.39.136.2749 > 128.32.25.39.110: P 36:42(6) ack 150 win 17371 (DF)
06/05/2003 20:04:35.276929 128.32.25.39.110 > 128.32.39.136.2749: P 150:985(835) ack 42 win 61440 (DF)
06/05/2003 20:04:35.299905 128.32.25.39.110 > 128.32.39.136.2749: P 985:990(5) ack 48 win 61440
06/05/2003 20:04:35.300398 128.32.25.39.110 > 128.32.39.136.2749: F 990:990(0) ack 48 win 61440
06/05/2003 20:04:35.301270 128.32.39.136.2749 > 128.32.25.39.110: F 48:48(0) ack 990 win 16531 (DF)
06/05/2003 20:04:35.302287 128.32.25.39.110 > 128.32.39.136.2749: F 990:990(0) ack 49 win 61440
06/05/2003 20:04:35.302844 128.32.39.136.2749 > 128.32.25.39.110: . ack 991 win 16531 (DF)
06/05/2003 20:04:38.568461 64.12.25.131.5190 > 128.32.39.238.32783: P 53:105(52) ack 12 win 16384 (DF)
06/05/2003 20:04:38.569458 128.32.39.238.32783 > 64.12.25.131.5190: . ack 105 win 48960 (DF)
06/05/2003 20:04:45.108679 128.32.39.112.3818 > 169.229.60.102.445: P 320:373(53) ack 371 win 17042 (DF)
06/05/2003 20:04:45.111021 169.229.60.102.445 > 128.32.39.112.3818: P 371:424(53) ack 373 win 63599 (DF)
06/05/2003 20:04:45.297039 128.32.39.112.3818 > 169.229.60.102.445: . ack 424 win 16989 (DF)
06/05/2003 20:04:55.811830 128.32.38.156.1088 > 216.136.173.179.5050: P 3102404724:3102404806(82) ack 353363031 win 16682 (DF)
06/05/2003 20:04:55.915064 216.136.173.179.5050 > 128.32.38.156.1088: . ack 82 win 65535 (DF)
06/05/2003 20:04:56.214006 128.32.38.156.1088 > 216.136.173.179.5050: P 82:169(87) ack 1 win 16682 (DF)
06/05/2003 20:04:56.314845 216.136.173.179.5050 > 128.32.38.156.1088: . ack 169 win 65535 (DF)
06/05/2003 20:04:57.878202 128.32.39.238.32783 > 64.12.25.131.5190: P 12:18(6) ack 105 win 48960 (DF)
06/05/2003 20:04:58.166151 64.12.25.131.5190 > 128.32.39.238.32783: . ack 18 win 16384 (DF)
06/05/2003 20:04:59.089104 128.32.38.156.1267 > 169.229.60.100.445: S 585450397:585450397(0) win 16384 <mss 1460,nop,nop,sackOK> (DF)
06/05/2003 20:04:59.090992 169.229.60.100.445 > 128.32.38.156.1267: S 1948340022:1948340022(0) ack 585450398 win 64240 <mss 1460,nop,nop,sackOK> (DF)
06/05/2003 20:04:59.092069 128.32.38.156.1267 > 169.229.60.100.445: . ack 1 win 17520 (DF)
06/05/2003 20:04:59.092935 128.32.38.156.1267 > 169.229.60.100.445: P 1:138(137) ack 1 win 17520 (DF)
06/05/2003 20:04:59.094872 169.229.60.100.445 > 128.32.38.156.1267: P 1:184(183) ack 138 win 64103 (DF)
06/05/2003 20:04:59.101933 128.32.38.156.1267 > 169.229.60.100.445: . 138:1598(1460) ack 184 win 17337 (DF)
06/05/2003 20:04:59.104417 128.32.38.156.1267 > 169.229.60.100.445: . 1598:3058(1460) ack 184 win 17337 (DF)
06/05/2003 20:04:59.105421 169.229.60.100.445 > 128.32.38.156.1267: . ack 3072 win 64240 (DF)
06/05/2003 20:04:59.109231 169.229.60.100.445 > 128.32.38.156.1267: P 184:611(427) ack 3072 win 64240 (DF)
06/05/2003 20:04:59.113018 169.229.60.100.445 > 128.32.38.156.1267: P 611:671(60) ack 3184 win 64128 (DF)
06/05/2003 20:04:59.114405 128.32.38.156.1267 > 169.229.60.100.445: P 3184:3260(76) ack 671 win 16850 (DF)
06/05/2003 20:04:59.116088 169.229.60.100.445 > 128.32.38.156.1267: P 671:895(224) ack 3260 win 64052 (DF)
06/05/2003 20:04:59.124155 128.32.38.156.1267 > 169.229.60.100.445: P 3260:3372(112) ack 895 win 16626 (DF)
06/05/2003 20:04:59.128320 169.229.60.100.445 > 128.32.38.156.1267: P 895:1161(266) ack 3372 win 63940 (DF)
06/05/2003 20:04:59.130122 128.32.38.156.1267 > 169.229.60.100.445: P 3372:3458(86) ack 1161 win 16360 (DF)
06/05/2003 20:04:59.132742 169.229.60.100.445 > 128.32.38.156.1267: P 1161:1329(168) ack 3458 win 63854 (DF)
06/05/2003 20:05:03.500118 128.32.38.156.1258 > 169.229.60.100.1026: F 4096:4096(0) ack 1687 win 17411 (DF)
06/05/2003 20:05:03.501379 169.229.60.100.1026 > 128.32.38.156.1258: . ack 4097 win 62996 (DF)
06/05/2003 20:05:03.501871 169.229.60.100.1026 > 128.32.38.156.1258: F 1687:1687(0) ack 4097 win 62996 (DF)
06/05/2003 20:05:03.502921 128.32.38.156.1258 > 169.229.60.100.1026: . ack 1688 win 17411 (DF)
06/05/2003 20:05:04.219294 216.136.173.179.5050 > 128.32.38.156.1088: P 1:95(94) ack 169 win 65535 (DF)
06/05/2003 20:05:04.342006 128.32.38.156.1088 > 216.136.173.179.5050: . ack 95 win 16588 (DF)
